<?xml version="1.0" encoding="utf-8" ?>
<plugin xmlns="http://ampliar.dev.br/projects/curupira/plugin/installer-plugin"
        xmlns:xsi="http://www.w3.org/2001/XMLSchema-instance"
        xsi:schemaLocation="http://ampliar.dev.br/projects/curupira/plugin/installer-plugin installer-plugin.xsd">
    <components>
        <component id="ruby" type="zip">
            <param name="SourceFile" value="C:\temp\ruby.zip" />
            <param name="TargetDir" value="P:\Ruby" />
            <remove>include\ruby-3.2.0\ruby.h</remove>
            <remove>include\ruby-3.2.0\ruby\io\*</remove>
        </component>
        <component id="InstallAppTest" type="msi" action="install">
            <param name="SourceFile" value="C:\temp\AppTeste.msi" />
            <param name="Params" value="/qn" />
        </component>
        <component id="Install.bat" type="bat">
            <param name="SourceFile" value="C:\temp\Install.bat" />
            <param name="Params" value="C:\temp\myapp" />
        </component>
        <component id="Installer.exe" type="exe">
            <param name="SourceFile" value="C:\temp\Installer.exe" />
            <param name="Params" value="C:\temp\myapp2" />
        </component>
    </components>
</plugin>
